{
  "schemaVersion": 1,
  "kind": "evidence-review-history",
  "id": "review-case-graphql-credential-named-variables-and-fields-without-value-bytes",
  "subject": {
    "kind": "case",
    "id": "graphql-credential-named-variables-and-fields-without-value-bytes"
  },
  "events": [
    {
      "seq": 1,
      "type": "authored",
      "at": "2026-10-04",
      "actor": {
        "id": "claude-research-agent",
        "role": "automation",
        "affiliation": "project-maintainer"
      },
      "note": "Authored by an AI agent run from the GraphQL October 2021 specification, the GraphQL over HTTP working draft, RFC 8259, RFC 3986 and the SendGrid key-length page, read on 2026-10-04, before any scanner was consulted; not reviewed. Origin of the inputs: evidence-derived and synthetic, not observed."
    }
  ],
  "notes": "Project-authored by the Redact Secret project, which maintains this repository; not independent evidence. Draft; not yet reviewed."
}
