{
  "schemaVersion": 1,
  "kind": "evidence-review-history",
  "id": "review-stripe-webhook-signing-secret",
  "subject": {
    "kind": "family",
    "id": "stripe:webhook-signing-secret"
  },
  "events": [
    {
      "seq": 1,
      "type": "reviewed",
      "at": "2026-09-27",
      "actor": {
        "id": "legacy-import",
        "role": "automation",
        "affiliation": "project-maintainer"
      },
      "verdict": "supports",
      "note": "Imported from the legacy dossier: research verdict 'ready', tier T1 (provider-documented), researchedAt 2026-09-27. The verdict and tier are re-expressed as research.state and an evidence class; no product status is carried.",
      "evidence": [
        {
          "url": "https://github.com/redact-secret/redact-secret-benchmarks/blob/ade8a10bd7922765110a68986b0690eb3861f2e5/benchmarks/support/dossiers/stripe.md",
          "pin": {
            "kind": "commit-permalink",
            "commit": "ade8a10bd7922765110a68986b0690eb3861f2e5"
          }
        },
        {
          "url": "https://github.com/redact-secret/redact-secret/blob/8b6a5fde52ecb4dfce13f09c7a947062d21483c7/docs/audits/evidence/726/README.md",
          "pin": {
            "kind": "commit-permalink",
            "commit": "8b6a5fde52ecb4dfce13f09c7a947062d21483c7"
          }
        }
      ],
      "externalRefs": [
        {
          "system": "github-issue",
          "id": "redact-secret/redact-secret#513",
          "url": "https://github.com/redact-secret/redact-secret/issues/513"
        },
        {
          "system": "github-issue",
          "id": "redact-secret/redact-secret#726",
          "url": "https://github.com/redact-secret/redact-secret/issues/726"
        },
        {
          "system": "github-issue",
          "id": "redact-secret/redact-secret#729",
          "url": "https://github.com/redact-secret/redact-secret/issues/729"
        },
        {
          "system": "github-issue",
          "id": "redact-secret/redact-secret-benchmarks#224",
          "url": "https://github.com/redact-secret/redact-secret-benchmarks/issues/224"
        },
        {
          "system": "github-issue",
          "id": "redact-secret/redact-secret-benchmarks#367",
          "url": "https://github.com/redact-secret/redact-secret-benchmarks/issues/367"
        },
        {
          "system": "github-issue",
          "id": "redact-secret/redact-secret-benchmarks#372",
          "url": "https://github.com/redact-secret/redact-secret-benchmarks/issues/372"
        }
      ]
    },
    {
      "seq": 2,
      "type": "observed",
      "at": "2026-09-27",
      "actor": {
        "id": "legacy-import",
        "role": "automation",
        "affiliation": "project-maintainer"
      },
      "note": "Legacy taxonomy.json note for stripe:webhook-signing-secret (verbatim legacy text; the date is the dossier researchedAt, not the authoring date): Same classifyFixture guard as the organization API key covers whsec_ values; stripe-token's pattern does not match them. Measured as the context-gated Beta.8 arrival family stripe-webhook-signing-secret (#211, research #224): Stripe documents the whsec_ prefix only; the body width and alphabet stay provisional (32 alphanumerics is a provider example, not a grammar; Stripe's own scrubber admits + / =). Scored as the arrival family stripe-webhook-signing-secret (#730; docs/decisions/2026-09-24-score-arrival-families-by-finding-type.md): the product types it inside the shared stripe-token detector as stripe_webhook_signing_secret, so its findings carry the arrival id and its status comes from its own contract, profile and ledger rows. stripe-webhook-signing-secret is not a registry detector id."
    },
    {
      "seq": 3,
      "type": "observed",
      "at": "2026-09-27",
      "actor": {
        "id": "legacy-import",
        "role": "automation",
        "affiliation": "project-maintainer"
      },
      "note": "Legacy contract review text for 'stripe-webhook-signing-secret' (verbatim legacy text; the date is the dossier researchedAt, not the authoring date): Arrival contract (#211, research #224, observed 2026-09-24). Context-constrained and provisional, per #211: Stripe documents the whsec_ prefix and where the secret is configured, never a body length or alphabet; its only full-length example has 32 alphanumerics, its own CLI scrubber admits base64 + / =, its canary sanitizer does not, and Svix/Standard Webhooks issue whsec_ too. Positives therefore score as policy beside a same-line Stripe context, use alphanumeric 32- or 64-character bodies that satisfy every candidate rule, and no twin mutates width or introduces + / =. Neither pinned peer (gitleaks 8.30.1, trufflehog 3.97.4) registers a whsec_ rule. Stripe-Signature digests, we_/ed_/evt_ ids and pk_ publishable keys are public controls. The public-prefix twin swaps whsec_ for pk_live_, which docs.stripe.com/keys documents as safe to expose."
    }
  ],
  "externalRefs": [
    {
      "system": "legacy-taxonomy-import",
      "id": "ade8a10bd7922765110a68986b0690eb3861f2e5:benchmarks/support/dossiers/stripe.md",
      "url": "https://github.com/redact-secret/redact-secret-benchmarks/blob/ade8a10bd7922765110a68986b0690eb3861f2e5/benchmarks/support/dossiers/stripe.md",
      "note": "families[id=stripe:webhook-signing-secret].research"
    },
    {
      "system": "legacy-taxonomy-import",
      "id": "ade8a10bd7922765110a68986b0690eb3861f2e5:benchmarks/support/taxonomy.json",
      "url": "https://github.com/redact-secret/redact-secret-benchmarks/blob/ade8a10bd7922765110a68986b0690eb3861f2e5/benchmarks/support/taxonomy.json",
      "note": "families[id=stripe:webhook-signing-secret]"
    }
  ]
}
