{
  "schemaVersion": 1,
  "kind": "evidence-review-history",
  "id": "review-x-oauth2-client-secret",
  "subject": {
    "kind": "family",
    "id": "x:oauth2-client-secret"
  },
  "events": [
    {
      "seq": 1,
      "type": "authored",
      "at": "2026-10-04",
      "actor": {
        "id": "research-agent",
        "role": "automation",
        "affiliation": "project-maintainer"
      },
      "note": "Candidate identified by an AI agent run from docs.x.com pages read on 2026-10-04; not reviewed, and an agent run is not an independent review."
    }
  ],
  "notes": "Project-authored by the Redact Secret project, which maintains this repository; not independent evidence. Draft; not yet reviewed."
}
