{
  "schemaVersion": 1,
  "kind": "evidence-review-history",
  "id": "review-pinecone-legacy-api-key",
  "subject": {
    "kind": "family",
    "id": "pinecone:legacy-api-key"
  },
  "events": [
    {
      "seq": 1,
      "type": "reviewed",
      "at": "2026-09-25",
      "actor": {
        "id": "legacy-import",
        "role": "automation",
        "affiliation": "project-maintainer"
      },
      "verdict": "supports",
      "note": "Imported from the legacy dossier: research verdict 'ready', tier T2 (tool-corroborated), researchedAt 2026-09-25. The verdict and tier are re-expressed as research.state and an evidence class; no product status is carried.",
      "evidence": [
        {
          "url": "https://github.com/redact-secret/redact-secret-benchmarks/blob/ade8a10bd7922765110a68986b0690eb3861f2e5/benchmarks/support/dossiers/pinecone.md",
          "pin": {
            "kind": "commit-permalink",
            "commit": "ade8a10bd7922765110a68986b0690eb3861f2e5"
          }
        },
        {
          "url": "https://github.com/redact-secret/redact-secret/blob/8b6a5fde52ecb4dfce13f09c7a947062d21483c7/docs/audits/evidence/726/README.md",
          "pin": {
            "kind": "commit-permalink",
            "commit": "8b6a5fde52ecb4dfce13f09c7a947062d21483c7"
          }
        }
      ],
      "externalRefs": [
        {
          "system": "github-issue",
          "id": "redact-secret/redact-secret#702",
          "url": "https://github.com/redact-secret/redact-secret/issues/702"
        },
        {
          "system": "github-issue",
          "id": "redact-secret/redact-secret#726",
          "url": "https://github.com/redact-secret/redact-secret/issues/726"
        },
        {
          "system": "github-issue",
          "id": "redact-secret/redact-secret-benchmarks#228",
          "url": "https://github.com/redact-secret/redact-secret-benchmarks/issues/228"
        },
        {
          "system": "github-issue",
          "id": "redact-secret/redact-secret-benchmarks#253",
          "url": "https://github.com/redact-secret/redact-secret-benchmarks/issues/253"
        }
      ]
    },
    {
      "seq": 2,
      "type": "observed",
      "at": "2026-09-25",
      "actor": {
        "id": "legacy-import",
        "role": "automation",
        "affiliation": "project-maintainer"
      },
      "note": "Legacy taxonomy.json note for pinecone:legacy-api-key (verbatim legacy text; the date is the dossier researchedAt, not the authoring date): Beta.8 context-gated arrival family pinecone-api-key-legacy (#212, research #228); the UUID shape is corroborated by unpinned tools only. Owned by the product pinecone-api-key detector since product main 2420e80 (redact-secret#766 and its ADR 2026-09-24-claim-a-legacy-pinecone-uuid-key-only-under-its-api-key-name): the UUID is redacted at high confidence under a Pinecone API-key name (PINECONE_API_KEY, pinecone_api_key, PINECONE_KEY, or api_key/apiKey/Api-Key on a line naming pinecone), and a bare UUID stays unclaimed. The detector reports it with the same pinecone_api_key finding type as pcsk_, so detectors stays empty: mapping the family to pinecone-api-key would merge it into that contract (#253)."
    },
    {
      "seq": 3,
      "type": "observed",
      "at": "2026-09-25",
      "actor": {
        "id": "legacy-import",
        "role": "automation",
        "affiliation": "project-maintainer"
      },
      "note": "Legacy contract review text for 'pinecone-api-key-legacy' (verbatim legacy text; the date is the dossier researchedAt, not the authoring date): Context-constrained arrival family (#228, #212): a legacy Pinecone API key is a bare 8-4-4-4-12 lowercase-hex UUID, lexically identical to the Pinecone key id, project id, service-account id and any other UUID, so no bare-value rule can separate it. It is recognised only beside a same-line Pinecone API-key identifier (PINECONE_API_KEY, pinecone.init(api_key=...), an Api-Key header to a pinecone.io host), scores as policy, and its twins keep the UUID byte-for-byte and change only that identifier. The UUID shape is corroborated by unpinned tools and community placeholders only (betterleaks pinecone-api-key.1 \"version 1 (UUID format)\" keyword-gated, GitGuardian \"Pinecone API Key\" v1); no provider source states it, and whether UUID keys still authenticate or can still be issued is unknown."
    }
  ],
  "externalRefs": [
    {
      "system": "legacy-taxonomy-import",
      "id": "ade8a10bd7922765110a68986b0690eb3861f2e5:benchmarks/support/dossiers/pinecone.md",
      "url": "https://github.com/redact-secret/redact-secret-benchmarks/blob/ade8a10bd7922765110a68986b0690eb3861f2e5/benchmarks/support/dossiers/pinecone.md",
      "note": "families[id=pinecone:legacy-api-key].research"
    },
    {
      "system": "legacy-taxonomy-import",
      "id": "ade8a10bd7922765110a68986b0690eb3861f2e5:benchmarks/support/taxonomy.json",
      "url": "https://github.com/redact-secret/redact-secret-benchmarks/blob/ade8a10bd7922765110a68986b0690eb3861f2e5/benchmarks/support/taxonomy.json",
      "note": "families[id=pinecone:legacy-api-key]"
    }
  ]
}
