{
  "schemaVersion": 1,
  "kind": "evidence-review-history",
  "id": "review-scenario-credential-in-nested-encoding-layers",
  "subject": {
    "kind": "scenario",
    "id": "credential-in-nested-encoding-layers"
  },
  "events": [
    {
      "seq": 1,
      "type": "authored",
      "at": "2026-10-03",
      "actor": {
        "id": "claude-research-agent",
        "role": "automation",
        "affiliation": "project-maintainer"
      },
      "note": "Authored by an AI agent run from RFC 4648 (rfc-editor-org-0da70d4b9a) read on 2026-10-03, before any scanner was consulted; not reviewed. The evidence basis is unresolved: no source settles whether or where an encoded credential must be covered; a maintainer decision is needed."
    }
  ],
  "notes": "Project-authored by the Redact Secret project, which maintains this repository; not independent evidence. Draft; not yet reviewed."
}
