{
  "schemaVersion": 1,
  "kind": "evidence-review-history",
  "id": "review-case-http-basic-password-containing-colon",
  "subject": {
    "kind": "case",
    "id": "http-basic-password-containing-colon"
  },
  "events": [
    {
      "seq": 1,
      "type": "authored",
      "at": "2026-10-03",
      "actor": {
        "id": "claude-research-agent",
        "role": "automation",
        "affiliation": "project-maintainer"
      },
      "note": "Authored by an AI agent run (issue #114, parent #92) from the cited standards read on 2026-10-03, before any scanner was consulted; synthetic values only; not independently reviewed."
    }
  ],
  "notes": "Project-authored by the Redact Secret project, which maintains this repository; not independent evidence. Draft; not yet reviewed."
}
