{
  "schemaVersion": 1,
  "kind": "evidence-review-history",
  "id": "review-case-algolia-analytics-api-key-acl-profile-and-data-sensitivity-unsettled",
  "subject": {
    "kind": "case",
    "id": "algolia-analytics-api-key-acl-profile-and-data-sensitivity-unsettled"
  },
  "events": [
    {
      "seq": 1,
      "type": "authored",
      "at": "2026-10-06",
      "actor": {
        "id": "claude-code-agent",
        "role": "automation",
        "affiliation": "project-maintainer"
      },
      "note": "Authored for credential-evidence#242 (Group D, D1 handoff) from the contract claims analytics-api-key/analytics-api-key-accepts-any-key-with-acl, analytics-api-key/analytics-api-key-regional-hosts, read on 2026-10-06 in this repository. Records what the contract settles and leaves open: Open questions open-question-2 to open-question-5 of the analytics contract. No expectation is asserted. Not an independent review."
    }
  ],
  "notes": "Project-authored by the Redact Secret project, which maintains this repository; not independent evidence. Draft; not yet reviewed."
}
