{
  "schemaVersion": 1,
  "kind": "evidence-review-history",
  "id": "review-case-personal-data-shaped-values-under-credential-only-scope",
  "subject": {
    "kind": "case",
    "id": "personal-data-shaped-values-under-credential-only-scope"
  },
  "events": [
    {
      "seq": 1,
      "type": "authored",
      "at": "2026-10-03",
      "actor": {
        "id": "research-agent",
        "role": "automation",
        "affiliation": "project-maintainer"
      },
      "note": "Authored by an AI agent run (issue #98, parent #92); synthetic values only (reserved example.invalid domain, fictional 555-0100 range); not independently reviewed. The credential-scope expectation follows the maintainer direction in issue #98; the deciding-maintainer and independent-reviewer record required for project-policy is not made by this run."
    },
    {
      "seq": 2,
      "type": "observed",
      "at": "2026-10-03",
      "actor": {
        "id": "research-agent",
        "role": "automation",
        "affiliation": "project-maintainer"
      },
      "verdict": "not-assertable",
      "note": "Statement 'expectation' is recorded as unresolved: The project-policy record (deciding maintainer, independent reviewer, dissent, reversing evidence) for the credential-only scope is not yet made."
    }
  ],
  "notes": "Project-authored by the Redact Secret project, which maintains this repository; not independent evidence. Draft; not yet reviewed."
}
