{
  "schemaVersion": 1,
  "kind": "evidence-review-history",
  "id": "review-helicone-write-api-key",
  "subject": {
    "kind": "family",
    "id": "helicone:write-api-key"
  },
  "events": [
    {
      "seq": 1,
      "type": "reviewed",
      "at": "2026-09-28",
      "actor": {
        "id": "legacy-import",
        "role": "automation",
        "affiliation": "project-maintainer"
      },
      "verdict": "supports",
      "note": "Imported from the legacy dossier: research verdict 'ready', tier T1 (provider-documented), researchedAt 2026-09-28. The verdict and tier are re-expressed as research.state and an evidence class; no product status is carried.",
      "evidence": [
        {
          "url": "https://github.com/redact-secret/redact-secret-benchmarks/blob/ade8a10bd7922765110a68986b0690eb3861f2e5/benchmarks/support/dossiers/helicone.md",
          "pin": {
            "kind": "commit-permalink",
            "commit": "ade8a10bd7922765110a68986b0690eb3861f2e5"
          }
        },
        {
          "url": "https://github.com/redact-secret/redact-secret/blob/8b6a5fde52ecb4dfce13f09c7a947062d21483c7/docs/audits/evidence/860/helicone.md",
          "pin": {
            "kind": "commit-permalink",
            "commit": "8b6a5fde52ecb4dfce13f09c7a947062d21483c7"
          }
        }
      ],
      "externalRefs": [
        {
          "system": "github-issue",
          "id": "redact-secret/redact-secret#860",
          "url": "https://github.com/redact-secret/redact-secret/issues/860"
        },
        {
          "system": "github-issue",
          "id": "redact-secret/redact-secret#907",
          "url": "https://github.com/redact-secret/redact-secret/issues/907"
        },
        {
          "system": "github-issue",
          "id": "redact-secret/redact-secret-benchmarks#434",
          "url": "https://github.com/redact-secret/redact-secret-benchmarks/issues/434"
        }
      ]
    },
    {
      "seq": 2,
      "type": "observed",
      "at": "2026-09-28",
      "actor": {
        "id": "legacy-import",
        "role": "automation",
        "affiliation": "project-maintainer"
      },
      "note": "Legacy taxonomy.json note for helicone:write-api-key (verbatim legacy text; the date is the dossier researchedAt, not the authoring date): Scored arrival family helicone-write-api-key: the product types it inside the shared helicone-api-key detector as helicone_write_api_key since redact-secret#907 (registry pinned at 1127bf9; scanners/families.mjs arrivalFindingTypes). Authored as a Beta.11 arrival family (#434 slice e, #860 Tier A handoff), contract in benchmarks/lib/beta8/434e.ts. T1."
    },
    {
      "seq": 3,
      "type": "observed",
      "at": "2026-09-28",
      "actor": {
        "id": "legacy-import",
        "role": "automation",
        "affiliation": "project-maintainer"
      },
      "note": "Legacy contract review text for 'helicone-write-api-key' (verbatim legacy text; the date is the dossier researchedAt, not the authoring date): Arrival evidence (#434, product redact-secret#907; #860 handoff helicone.md, READY). The write-only key can send requests and logs into the org; no provider source says it is safe to publish (unlike PostHog phc_ or Stripe pk_), so the handoff detects and redacts it under its own type, which a user policy can downgrade. It may appear in the gateway URL path (https://gateway.helicone.ai/<key>/v1/), where / delimits it. Neither pinned peer has a Helicone rule."
    }
  ],
  "externalRefs": [
    {
      "system": "legacy-taxonomy-import",
      "id": "ade8a10bd7922765110a68986b0690eb3861f2e5:benchmarks/support/dossiers/helicone.md",
      "url": "https://github.com/redact-secret/redact-secret-benchmarks/blob/ade8a10bd7922765110a68986b0690eb3861f2e5/benchmarks/support/dossiers/helicone.md",
      "note": "families[id=helicone:write-api-key].research"
    },
    {
      "system": "legacy-taxonomy-import",
      "id": "ade8a10bd7922765110a68986b0690eb3861f2e5:benchmarks/support/taxonomy.json",
      "url": "https://github.com/redact-secret/redact-secret-benchmarks/blob/ade8a10bd7922765110a68986b0690eb3861f2e5/benchmarks/support/taxonomy.json",
      "note": "families[id=helicone:write-api-key]"
    }
  ]
}
