{
  "schemaVersion": 1,
  "kind": "evidence-review-history",
  "id": "review-case-credential-split-by-string-literal-line-continuation",
  "subject": {
    "kind": "case",
    "id": "credential-split-by-string-literal-line-continuation"
  },
  "events": [
    {
      "seq": 1,
      "type": "authored",
      "at": "2026-10-03",
      "actor": {
        "id": "claude-research-agent",
        "role": "automation",
        "affiliation": "project-maintainer"
      },
      "note": "Authored by an AI agent run (issue #95, parent #92) from the cited language and format specifications and the provider support page, read on 2026-10-03, before any scanner output was consulted; synthetic values only; not independently reviewed."
    }
  ],
  "notes": "Project-authored by the Redact Secret project, which maintains this repository; not independent evidence. Draft; not yet reviewed."
}
