{
  "schemaVersion": 1,
  "kind": "evidence-review-history",
  "id": "review-case-connection-uri-unencoded-sub-delimiter-passwords",
  "subject": {
    "kind": "case",
    "id": "connection-uri-unencoded-sub-delimiter-passwords"
  },
  "events": [
    {
      "seq": 1,
      "type": "authored",
      "at": "2026-10-03",
      "actor": {
        "id": "research-agent",
        "role": "automation",
        "affiliation": "project-maintainer"
      },
      "note": "Authored 2026-10-03 by an AI agent run for issue #111 (parent #92) from the vendor and standard pages cited in the expectation, each read on that date; not independently reviewed. Expectation frozen before any scanner replay; scanner output was not consulted."
    }
  ],
  "notes": "Project-authored by the Redact Secret project, which maintains this repository; not independent evidence. Draft; not yet reviewed."
}
