{
  "schemaVersion": 1,
  "kind": "evidence-review-history",
  "id": "review-case-netrc-login-field-and-anonymous-template-sensitivity",
  "subject": {
    "kind": "case",
    "id": "netrc-login-field-and-anonymous-template-sensitivity"
  },
  "events": [
    {
      "seq": 1,
      "type": "authored",
      "at": "2026-10-03",
      "actor": {
        "id": "research-agent",
        "role": "automation",
        "affiliation": "project-maintainer"
      },
      "note": "Authored by an AI agent run (issue #113, parent #92) from the cited provider pages read on 2026-10-03, before any scanner was consulted; synthetic values only; not independently reviewed. Expectation left unresolved: curl documents neither the confidentiality of a login value nor that the anonymous password is a placeholder."
    },
    {
      "seq": 2,
      "type": "observed",
      "at": "2026-10-03",
      "actor": {
        "id": "research-agent",
        "role": "automation",
        "affiliation": "project-maintainer"
      },
      "verdict": "not-assertable",
      "note": "Statement 'expectation' is recorded as unresolved: curl documents neither the confidentiality of a login value nor that the anonymous password is a placeholder."
    }
  ],
  "notes": "Project-authored by the Redact Secret project, which maintains this repository; not independent evidence. Draft; not yet reviewed."
}
