{
  "schemaVersion": 1,
  "kind": "evidence-review-history",
  "id": "review-dropbox-access-token",
  "subject": {
    "kind": "family",
    "id": "dropbox:access-token"
  },
  "events": [
    {
      "seq": 1,
      "type": "authored",
      "at": "2026-10-04",
      "actor": {
        "id": "research-agent",
        "role": "automation",
        "affiliation": "project-maintainer"
      },
      "note": "Candidate identified by an AI agent run from the OAuth page, the Authorization page, the Authentication Types page and the Webhooks page read on 2026-10-04; not reviewed, and an agent run is not an independent review."
    }
  ],
  "notes": "Project-authored by the Redact Secret project, which maintains this repository; not independent evidence. Draft; not yet reviewed."
}
